{"content":{"constraint_digest":"sha256:5b673432b26401b123bc4044d0d3c87796ec8165ec16d444e186a3c33229acd9","constraints":{"assignments":[{"net_class_id":"class:audio","net_id":"net:name:08d61b0ef81fc97b359093a799d2cf7c"},{"net_class_id":"class:default","net_id":"net:name:ccdd8d41edbac58e6d53310d1fccffd0"}],"differential_pairs":[],"length_rules":[],"net_classes":[{"clearance_nm":300000,"id":"class:audio","name":"Audio","track_width_nm":300000,"via_diameter_nm":900000,"via_drill_nm":450000},{"clearance_nm":250000,"id":"class:default","name":"Default","track_width_nm":250000,"via_diameter_nm":800000,"via_drill_nm":400000}]},"copper_layers":[{"id":"layer:F.Cu","index":0,"kind":"signal","name":"F.Cu"},{"id":"layer:B.Cu","index":1,"kind":"signal","name":"B.Cu"}],"items":{"arcs":[{"end":{"x_nm":17000000,"y_nm":9000000},"id":"arc:kicad:10000000-0000-0000-0000-000000000006","layer_id":"layer:F.Cu","locked":false,"mid":{"x_nm":16000000,"y_nm":10000000},"net_id":"net:name:08d61b0ef81fc97b359093a799d2cf7c","start":{"x_nm":15000000,"y_nm":9000000},"width_nm":250000}],"keepouts":[{"boundary":{"points":[{"x_nm":2000000,"y_nm":2000000},{"x_nm":5000000,"y_nm":2000000},{"x_nm":5000000,"y_nm":5000000},{"x_nm":2000000,"y_nm":5000000}]},"id":"keepout:kicad:10000000-0000-0000-0000-000000000009","layer_ids":["layer:F.Cu","layer:B.Cu"],"locked":false,"prohibit_footprints":false,"prohibit_pads":false,"prohibit_tracks":true,"prohibit_vias":true,"prohibit_zones":true}],"pads":[{"center":{"x_nm":10000000,"y_nm":11000000},"drill_x_nm":null,"drill_y_nm":null,"id":"pad:kicad:10000000-0000-0000-0000-000000000002","kind":"smd","layer_ids":["layer:F.Cu"],"locked":false,"net_id":"net:name:08d61b0ef81fc97b359093a799d2cf7c","rotation_udeg":90000000,"roundrect_radius_nm":250000,"shape":"roundrect","size_x_nm":2000000,"size_y_nm":1000000},{"center":{"x_nm":10000000,"y_nm":9000000},"drill_x_nm":1000000,"drill_y_nm":1000000,"id":"pad:kicad:10000000-0000-0000-0000-000000000003","kind":"through_hole","layer_ids":["layer:F.Cu","layer:B.Cu"],"locked":false,"net_id":"net:name:ccdd8d41edbac58e6d53310d1fccffd0","rotation_udeg":180000000,"roundrect_radius_nm":null,"shape":"circle","size_x_nm":2000000,"size_y_nm":2000000}],"segments":[{"end":{"x_nm":15000000,"y_nm":9000000},"id":"segment:kicad:10000000-0000-0000-0000-000000000005","layer_id":"layer:F.Cu","locked":true,"net_id":"net:name:08d61b0ef81fc97b359093a799d2cf7c","start":{"x_nm":9000000,"y_nm":9000000},"width_nm":250000}],"vias":[{"center":{"x_nm":17000000,"y_nm":9000000},"diameter_nm":800000,"drill_nm":400000,"end_layer_id":"layer:B.Cu","id":"via:kicad:10000000-0000-0000-0000-000000000007","kind":"through","locked":false,"net_id":"net:name:08d61b0ef81fc97b359093a799d2cf7c","start_layer_id":"layer:F.Cu"}],"zones":[{"boundary":{"points":[{"x_nm":1000000,"y_nm":1000000},{"x_nm":39000000,"y_nm":1000000},{"x_nm":39000000,"y_nm":29000000},{"x_nm":1000000,"y_nm":29000000}]},"clearance_nm":200000,"fill_mode":"solid","id":"zone:kicad:10000000-0000-0000-0000-000000000008","island_removal":"always","layer_id":"layer:B.Cu","locked":false,"min_thickness_nm":200000,"net_id":"net:name:ccdd8d41edbac58e6d53310d1fccffd0","pad_connection":"thermal","priority":0,"thermal_bridge_width_nm":300000,"thermal_gap_nm":300000}]},"nets":[{"id":"net:name:08d61b0ef81fc97b359093a799d2cf7c","name":"SIG_µ"},{"id":"net:name:ccdd8d41edbac58e6d53310d1fccffd0","name":"GND"}],"outline":{"contours":[{"holes":[],"id":"contour:kicad:10000000-0000-0000-0000-000000000004","outer":{"points":[{"x_nm":0,"y_nm":0},{"x_nm":40000000,"y_nm":0},{"x_nm":40000000,"y_nm":30000000},{"x_nm":0,"y_nm":30000000}]}}]},"source":{"format":"kicad_pcb","format_version":"20260206","generator":"pcbnew","revision":"sha256:58f35401a1bb75bbf33a47009dda92720284d8c67561c87fe9e2698a9f84fd06"},"units":{"angle":"udeg","distance":"nm"}},"schema":"copper.board-ir","schema_version":"0.1.0","snapshot_digest":"sha256:f546b4e5913aeb791208221890a89f393333e574326d0a529ef6fc7253c99255"}
